{
  "record_id": "nft-record-cipher001",
  "schema_family": "nft_record",
  "kin_id": "cipher-001",
  "kin_name": "Cipher",
  "mint_address": "CiPh3rKraK3nMintAddress123456789ABCDEFGH",
  "glb_url": "https://assets.kr8tiv.ai/kin/cipher.glb",
  "owner_wallet": "CiPh3rOwn3rWallet123456789ABCDEFGH",
  "creator_wallet": "Kr8tivCreatorWallet123456789ABCDEFGHIJ",
  "chain": "devnet",
  "collection_address": "Kr8tivG3n3s1sS1x123456789ABCDEFGHIJKL",
  "metadata": {
    "name": "Cipher - Code Kraken",
    "symbol": "KIN",
    "uri": "https://assets.kr8tiv.ai/metadata/cipher.json",
    "seller_fee_basis_points": 500,
    "creators": [
      {
        "address": "Kr8tivCreatorWallet123456789ABCDEFGHIJ",
        "share": 100,
        "verified": true
      }
    ],
    "properties": {
      "specialization": "web-design",
      "bloodline": "Code Kraken",
      "generation": 1,
      "attributes": [
        {"trait_type": "Species", "value": "Kraken"},
        {"trait_type": "Element", "value": "Digital"},
        {"trait_type": "Rarity", "value": "Genesis"},
        {"trait_type": "Tentacles", "value": 8},
        {"trait_type": "Aura", "value": "Neon Blue"}
      ]
    }
  },
  "minted_at": "2026-03-15T10:00:00Z",
  "last_verified_at": "2026-03-23T22:00:00Z",
  "verification_status": "verified",
  "transfer_count": 0,
  "last_transfer_at": null,
  "transaction_signature": "5J8k2mN7pQ1rS4tU6vW9xY2zA3bC5dE7fG9hJ1kL3mN5oP7qR9sT1uV3wX5yZ7",
  "boot_hash": "a1b2c3d4e5f6789012345678901234567890abcdef1234567890abcdef123456",
  "explorer_url": "https://explorer.solana.com/address/CiPh3rKraK3nMintAddress123456789ABCDEFGH?cluster=devnet",
  "created_at": "2026-03-15T10:00:00Z",
  "updated_at": "2026-03-23T22:00:00Z"
}
